index,name,nameEng,description,image,type
083,SS 블랙 앤 골드 스탠리 보온병 500ml,SS black&gold stanley thermos 500ml,우아함과 기품이 느껴지는 블랙과 골드 컬러의 조화로 계절과 성별에 구애받지 않고 사용할 수 있는 심플한 디자인의 500ml 스테인리스 보온병입니다.,https://image.istarbucks.co.kr/upload/store/skuimg/2020/09/%5B9300000002610%5D_20200918110021841.jpg,
084,사이렌 리사이클드 쇼퍼백,Siren recycled shopper bag,폴더블 쇼퍼백으로 파우치 형태로 압축 가능합니다.,https://image.istarbucks.co.kr/upload/store/skuimg/2022/04/%5B9300000003604%5D_20220413141039371.jpg,
085,스타벅스 리유저블 스트로 세트,Starbucks reusable straw set,"실리콘 스트로 3종과 세척솔, 린넨 파우치로 구성된 세트 상품입니다.",https://image.istarbucks.co.kr/upload/store/skuimg/2020/10/%5B9300000002615%5D_20201007140436517.jpg,
086,티바나 잉글리쉬 브렉퍼스트 12개입,Teavana English breakfast 12ea,인도와 한국의 홍차가 블렌딩 된 잉글리쉬 브렉퍼스트 티 입니다.,https://image.istarbucks.co.kr/upload/store/skuimg/2021/04/%5B11120812%5D_20210415165337878.jpg,
087,티바나 얼 그레이 12개입,Teavana Earl grey 12ea,향기로운 천연 베르가못 오일과 그윽한 라벤더가 함유된 산뜻한 블렌딩 티입니다.,https://image.istarbucks.co.kr/upload/store/skuimg/2021/04/%5B11120814%5D_20210415165244439.jpg,
088,티바나 민트 블렌드 12개입,Teavana Mint blend 12ea,스타벅스에서 새롭게 선보이는 티바나 민트 블렌드 티입니다.,https://image.istarbucks.co.kr/upload/store/skuimg/2021/04/%5B11120815%5D_20210415165152783.jpg,
089,티바나 히비스커스 12개입,TVNA HIBISCUS 12CT KR,"산뜻한 파파야와 망고에 레몬그라스를 넣은 천연 무 카페인 블렌딩 티로, 히비스커스 꽃을 넣어 약간의 산미와 풍미를 느낄 수 있는 상큼한 티입니다.",https://image.istarbucks.co.kr/upload/store/skuimg/2021/08/%5B11120816%5D_20210831161156862.jpg,
090,사이렌 고케틀,Siren go-kettle,머그와 결합하여 사용하는 실리콘소재의 케틀입니다.,https://image.istarbucks.co.kr/upload/store/skuimg/2022/04/%5B9300000003839%5D_20220413141839541.jpg,
091,화이트 사이렌 커피 클립 스쿱,White siren coffee clip scoop,"[2021 스타벅스 화이트 코어 브루잉 MD]
따뜻한 화이트 컬러 배색의 심플하면서도 고급스러운 커피 클립 스쿱으로 나만의 홈 카페를 완벽하게 꾸며줄 상품입니다.",https://image.istarbucks.co.kr/upload/store/skuimg/2021/01/%5B9300000003037%5D_20210113091500413.jpg,
092,브라운 사이렌 커피 프레스 450ml,Brown siren coffee press 450ml,"[2021 스타벅스 브라운 코어 브루잉 MD]
브라운 컬러 배색의 심플하면서도 고급스러운 커피 프레스기로 나만의 홈 카페를 완벽하게 꾸며줄 상품입니다.",https://image.istarbucks.co.kr/upload/store/skuimg/2021/06/%5B9300000003332%5D_20210622100850905.jpg,
093,브라운 사이렌 글라스 자 946ml,Brown siren glass jar 946ml,"[2021 스타벅스 브라운 코어 브루잉 MD]
브라운 컬러 배색이 포인트로 심플하면서도 감각적인 디자인이 특징인 946ml 용량의 찬 음료 전용 글라스 자입니다.",https://image.istarbucks.co.kr/upload/store/skuimg/2021/06/%5B9300000003333%5D_20210622101748643.jpg,
094,스타벅스 바닐라 시럽 280ml,Starbucks vanilla syrup 280ml,나만의 홈 카페를 즐길 수 있는 스타벅스 바닐라 시럽 280ml 상품입니다.,https://image.istarbucks.co.kr/upload/store/skuimg/2022/05/%5B9300000003918%5D_20220511095504617.jpg,
095,스타벅스 헤이즐넛 시럽 280ml,Starbucks Hazelnut Syrup 280ml,나만의 홈 카페를 즐길 수 있는 스타벅스 헤이즐넛 시럽 280ml 상품입니다.,https://image.istarbucks.co.kr/upload/store/skuimg/2022/05/%5B9300000003919%5D_20220511101339693.jpg,